{
  "slug": "christ-presbyterian-church-tucson",
  "name": "Christ Presbyterian Church",
  "aka": [
    "CPC Tucson"
  ],
  "tradition": "presbyterian_reformed",
  "denomination": "Presbyterian Church (USA) - Presbytery de Cristo",
  "website": "https://cpctucsonaz.org/",
  "location": {
    "address": "6565 E Broadway Blvd",
    "postal_code": "85710",
    "lat": 32.2215,
    "lng": -110.8571,
    "geocode": "approximate",
    "city": "Tucson",
    "state": "AZ"
  },
  "pastors": [
    {
      "name": "Steve Melde",
      "role": "Pastor and Head of Staff",
      "bio_url": "https://cpctucsonaz.org/about-cpc/our-staff/",
      "plagiarism": {
        "status": "unchecked"
      },
      "ai_writing": {
        "status": "unchecked"
      },
      "active": true
    }
  ],
  "youtube": {
    "channel_url": "https://www.youtube.com/channel/UCT_gkw6j7gZx5VwVpG7wsIA",
    "handle": "@cpctucsonaz2095",
    "transcripts_available": "unknown"
  },
  "sources": [
    {
      "label": "Christ Presbyterian Church Tucson official site",
      "url": "https://cpctucsonaz.org/",
      "accessed": "2026-09-11"
    },
    {
      "label": "Christ Presbyterian Church staff page",
      "url": "http://cpctucsonaz.org/about-cpc/our-staff/",
      "accessed": "2026-09-11"
    },
    {
      "label": "Yelp: Christ Presbyterian Church, 6565 E Broadway Blvd",
      "url": "https://www.yelp.com/biz/christ-presbyterian-church-tucson",
      "accessed": "2026-09-11"
    },
    {
      "label": "PC(USA) congregation directory: Christ Church, Tucson AZ",
      "url": "https://pcusa.org/congregation/christ-church-tucson-az",
      "accessed": "2026-09-11"
    },
    {
      "label": "Christ Presbyterian Tucson Facebook page",
      "url": "https://www.facebook.com/ChristPresbyterianTucson/",
      "accessed": "2026-09-11"
    },
    {
      "label": "Christ Presbyterian Church - About CPC (states PC(USA) and Presbytery de Cristo)",
      "url": "https://cpctucsonaz.org/about-cpc/",
      "accessed": "2026-09-10"
    },
    {
      "label": "Christ Presbyterian Church - Contact Us (street address)",
      "url": "https://cpctucsonaz.org/contact-us/",
      "accessed": "2026-09-10"
    },
    {
      "label": "CPCTucsonAZ YouTube channel (linked from the church site footer)",
      "url": "https://www.youtube.com/channel/UCT_gkw6j7gZx5VwVpG7wsIA",
      "accessed": "2026-09-10"
    }
  ],
  "summary": "Not yet reviewed.",
  "notes": "Mainline PC(USA), not PCA. Affiliation confirmed 2026-09-10 from the church's own About page: 'Christ Presbyterian Church is part of the Presbyterian Church (USA) and is one of twenty-nine churches within Presbytery de Cristo.' Address 6565 E. Broadway Blvd., Tucson AZ 85710 confirmed from cpctucsonaz.org/contact-us/. Steve Melde is the only pastor on the staff page (Pastor and Head of Staff); the rest of the staff are non-preaching (music, children's education, office, AV), so he is the only preaching pastor recorded. The church links a YouTube channel (@cpctucsonaz2095) from its site footer; the channel has no playlists, so sermons would have to be pulled from the uploads/videos feed and it is not confirmed that full sermons (as opposed to whole services) are posted. Note it shares the Broadway corridor with Fellowship Bible Church (6700 E Broadway); different churches, do not conflate. Coordinates are still only approximate; run tools/geocode.py.",
  "updated_at": "2026-09-10",
  "updated_by": "claude research agent (facts)"
}
